{"id":"OUT-1","format":"xlsx","state":"completed","idempotencyKey":"product:export:1","attempt":1,"requestScope":{"filters":{"region":"west"},"selection":["asset-1"]},"renderedScope":{"filters":{"region":"west"},"selection":["asset-1"]},"authorization":{"requestedBy":"user-1","recipient":"user-1","recipientAuthorized":true},"snapshot":{"locale":"en-US","currency":"USD","timezone":"America/Chicago","rounding":"2dp-half-even","disclosures":["synthetic fixture"],"generatedAt":"2026-08-05T10:00:00Z","calculationVersion":"calc-v1","contentSha256":"aaaaaaaaaaaaaaaaaaaaaaaaaaaaaaaaaaaaaaaaaaaaaaaaaaaaaaaaaaaaaaaa"},"delivery":{"signedUrlExpiresAt":"2026-08-05T13:00:00Z","downloadState":"available"}}
